[
  {
    "stance_id": "stance-BATCH-2026-008-001",
    "proposition_id": "proposition-BATCH-2026-008-001",
    "statement_id": "statement-BATCH-2026-006-009",
    "relationship_type": "supports",
    "scope_match": "substantially_comparable",
    "confidence": 0.9,
    "rationale": "The statement directly advances the proposition within the source-defined scope.",
    "review_status": "machine_mapped_human_review_pending",
    "workflow_status": "propositions_mapped",
    "machine_review_status": "ready_for_human_review",
    "human_review_status": "pending",
    "reviewed_by": null,
    "reviewed_at": null,
    "provenance": [
      {
        "source_url": "https://www.ietf.org/archive/id/draft-klrc-aiagent-auth-02.html",
        "accessed_at": "2026-08-15",
        "retrieval_method": "machine-assisted scope comparison against independently checked statement record",
        "exact_locator": "Revision 02 HTML, Section 3 \"Agents are workloads\", paragraphs 1-3",
        "content_hash": "e34f335c56546a6d91d88d43159c9f80d4dcfbbad020d41c31607fc56848befa",
        "batch_id": "BATCH-2026-008",
        "prompt_id": "OEII-PROPOSITION-MAPPING",
        "prompt_version": "2.0",
        "notes": "Staging stance decision; named human review pending."
      }
    ],
    "revision_history": [
      {
        "changed_at": "2026-08-15T23:30:00Z",
        "changed_by": "OpenAI Codex",
        "summary": "Created scope-reviewed staging stance relationship.",
        "batch_id": "BATCH-2026-008"
      }
    ]
  },
  {
    "stance_id": "stance-BATCH-2026-008-002",
    "proposition_id": "proposition-BATCH-2026-008-001",
    "statement_id": "statement-BATCH-2026-006-010",
    "relationship_type": "narrows",
    "scope_match": "substantially_comparable",
    "confidence": 0.9,
    "rationale": "The statement specifies a narrower implementation case within the proposition.",
    "review_status": "machine_mapped_human_review_pending",
    "workflow_status": "propositions_mapped",
    "machine_review_status": "ready_for_human_review",
    "human_review_status": "pending",
    "reviewed_by": null,
    "reviewed_at": null,
    "provenance": [
      {
        "source_url": "https://www.ietf.org/archive/id/draft-klrc-aiagent-auth-02.html",
        "accessed_at": "2026-08-15",
        "retrieval_method": "machine-assisted scope comparison against independently checked statement record",
        "exact_locator": "Revision 02 HTML, Section 5 \"Agent Identifier\", normative paragraph",
        "content_hash": "e34f335c56546a6d91d88d43159c9f80d4dcfbbad020d41c31607fc56848befa",
        "batch_id": "BATCH-2026-008",
        "prompt_id": "OEII-PROPOSITION-MAPPING",
        "prompt_version": "2.0",
        "notes": "Staging stance decision; named human review pending."
      }
    ],
    "revision_history": [
      {
        "changed_at": "2026-08-15T23:30:00Z",
        "changed_by": "OpenAI Codex",
        "summary": "Created scope-reviewed staging stance relationship.",
        "batch_id": "BATCH-2026-008"
      }
    ]
  },
  {
    "stance_id": "stance-BATCH-2026-008-003",
    "proposition_id": "proposition-BATCH-2026-008-001",
    "statement_id": "statement-BATCH-2026-006-013",
    "relationship_type": "supports",
    "scope_match": "substantially_comparable",
    "confidence": 0.9,
    "rationale": "The statement directly advances the proposition within the source-defined scope.",
    "review_status": "machine_mapped_human_review_pending",
    "workflow_status": "propositions_mapped",
    "machine_review_status": "ready_for_human_review",
    "human_review_status": "pending",
    "reviewed_by": null,
    "reviewed_at": null,
    "provenance": [
      {
        "source_url": "https://www.ietf.org/archive/id/draft-klrc-aiagent-auth-02.html",
        "accessed_at": "2026-08-15",
        "retrieval_method": "machine-assisted scope comparison against independently checked statement record",
        "exact_locator": "Revision 02 HTML, Section 3 \"Agents are workloads\", paragraph after Figure 1",
        "content_hash": "e34f335c56546a6d91d88d43159c9f80d4dcfbbad020d41c31607fc56848befa",
        "batch_id": "BATCH-2026-008",
        "prompt_id": "OEII-PROPOSITION-MAPPING",
        "prompt_version": "2.0",
        "notes": "Staging stance decision; named human review pending."
      }
    ],
    "revision_history": [
      {
        "changed_at": "2026-08-15T23:30:00Z",
        "changed_by": "OpenAI Codex",
        "summary": "Created scope-reviewed staging stance relationship.",
        "batch_id": "BATCH-2026-008"
      }
    ]
  },
  {
    "stance_id": "stance-BATCH-2026-008-004",
    "proposition_id": "proposition-BATCH-2026-008-001",
    "statement_id": "statement-BATCH-2026-006-015",
    "relationship_type": "provides_evidence",
    "scope_match": "substantially_comparable",
    "confidence": 0.9,
    "rationale": "The statement supplies empirical or problem evidence relevant to the proposition.",
    "review_status": "machine_mapped_human_review_pending",
    "workflow_status": "propositions_mapped",
    "machine_review_status": "ready_for_human_review",
    "human_review_status": "pending",
    "reviewed_by": null,
    "reviewed_at": null,
    "provenance": [
      {
        "source_url": "https://openid.net/wp-content/uploads/2025/10/Identity-Management-for-Agentic-AI.pdf",
        "accessed_at": "2026-08-15",
        "retrieval_method": "machine-assisted scope comparison against independently checked statement record",
        "exact_locator": "PDF file p. 3 (document p. 2), Executive Summary, \"User impersonation by agents\", October 2025 version",
        "content_hash": "e6a0e5909fcb2486568180f69d511ae2af8d20a1bfb3028b39b3d1072846f4f3",
        "batch_id": "BATCH-2026-008",
        "prompt_id": "OEII-PROPOSITION-MAPPING",
        "prompt_version": "2.0",
        "notes": "Staging stance decision; named human review pending."
      }
    ],
    "revision_history": [
      {
        "changed_at": "2026-08-15T23:30:00Z",
        "changed_by": "OpenAI Codex",
        "summary": "Created scope-reviewed staging stance relationship.",
        "batch_id": "BATCH-2026-008"
      }
    ]
  },
  {
    "stance_id": "stance-BATCH-2026-008-005",
    "proposition_id": "proposition-BATCH-2026-008-001",
    "statement_id": "statement-BATCH-2026-006-016",
    "relationship_type": "supports",
    "scope_match": "substantially_comparable",
    "confidence": 0.9,
    "rationale": "The statement directly advances the proposition within the source-defined scope.",
    "review_status": "machine_mapped_human_review_pending",
    "workflow_status": "propositions_mapped",
    "machine_review_status": "ready_for_human_review",
    "human_review_status": "pending",
    "reviewed_by": null,
    "reviewed_at": null,
    "provenance": [
      {
        "source_url": "https://openid.net/wp-content/uploads/2025/10/Identity-Management-for-Agentic-AI.pdf",
        "accessed_at": "2026-08-15",
        "retrieval_method": "machine-assisted scope comparison against independently checked statement record",
        "exact_locator": "PDF file p. 19 (document p. 18), Section 3.2 \"From Impersonation to Delegation (On-Behalf-Of)\", October 2025 version",
        "content_hash": "e6a0e5909fcb2486568180f69d511ae2af8d20a1bfb3028b39b3d1072846f4f3",
        "batch_id": "BATCH-2026-008",
        "prompt_id": "OEII-PROPOSITION-MAPPING",
        "prompt_version": "2.0",
        "notes": "Staging stance decision; named human review pending."
      }
    ],
    "revision_history": [
      {
        "changed_at": "2026-08-15T23:30:00Z",
        "changed_by": "OpenAI Codex",
        "summary": "Created scope-reviewed staging stance relationship.",
        "batch_id": "BATCH-2026-008"
      }
    ]
  },
  {
    "stance_id": "stance-BATCH-2026-008-006",
    "proposition_id": "proposition-BATCH-2026-008-001",
    "statement_id": "statement-BATCH-2026-006-018",
    "relationship_type": "supports",
    "scope_match": "substantially_comparable",
    "confidence": 0.9,
    "rationale": "The statement directly advances the proposition within the source-defined scope.",
    "review_status": "machine_mapped_human_review_pending",
    "workflow_status": "propositions_mapped",
    "machine_review_status": "ready_for_human_review",
    "human_review_status": "pending",
    "reviewed_by": null,
    "reviewed_at": null,
    "provenance": [
      {
        "source_url": "https://openid.net/wp-content/uploads/2025/10/Identity-Management-for-Agentic-AI.pdf",
        "accessed_at": "2026-08-15",
        "retrieval_method": "machine-assisted scope comparison against independently checked statement record",
        "exact_locator": "PDF file p. 15 (document p. 14), end of Section 2.11, October 2025 version",
        "content_hash": "e6a0e5909fcb2486568180f69d511ae2af8d20a1bfb3028b39b3d1072846f4f3",
        "batch_id": "BATCH-2026-008",
        "prompt_id": "OEII-PROPOSITION-MAPPING",
        "prompt_version": "2.0",
        "notes": "Staging stance decision; named human review pending."
      }
    ],
    "revision_history": [
      {
        "changed_at": "2026-08-15T23:30:00Z",
        "changed_by": "OpenAI Codex",
        "summary": "Created scope-reviewed staging stance relationship.",
        "batch_id": "BATCH-2026-008"
      }
    ]
  },
  {
    "stance_id": "stance-BATCH-2026-008-007",
    "proposition_id": "proposition-BATCH-2026-008-001",
    "statement_id": "statement-BATCH-2026-006-045",
    "relationship_type": "qualifies",
    "scope_match": "partial_scope_match_high_stakes_only",
    "confidence": 0.78,
    "rationale": "The statement limits the proposition or identifies a condition that must remain explicit.",
    "review_status": "machine_mapped_human_review_pending",
    "workflow_status": "propositions_mapped",
    "machine_review_status": "ready_for_human_review",
    "human_review_status": "pending",
    "reviewed_by": null,
    "reviewed_at": null,
    "provenance": [
      {